{
  "schema_version": "1",
  "product": "boviscan",
  "version": "0.2.0",
  "channel": "dev",
  "created_at": "2026-09-12T00:00:00Z",
  "min_device_version": "0.1.0",
  "artifacts": [
    {
      "name": "livestock-weight-device-0.2.0-py3-none-any.whl",
      "url": "https://example.invalid/boviscan/releases/0.2.0/livestock-weight-device-0.2.0-py3-none-any.whl",
      "sha256": "0000000000000000000000000000000000000000000000000000000000000000",
      "size": 0
    }
  ],
  "rollback": {
    "version": "0.1.0",
    "slot": "previous"
  },
  "signatures": [
    {
      "alg": "ed25519",
      "key_id": "ops-example-not-a-real-key",
      "sig": "PLACEHOLDER_BASE64_SIGNATURE_NOT_A_REAL_KEY"
    }
  ]
}
